<?xml version="1.0" encoding="UTF-8"?>
<structs xsi:noNamespaceSchemaLocation="../../xsd/pnet.xsd"
         xmlns:xsi="http://www.w3.org/2001/XMLSchema-instance"
>
<include-structs href="struct_volume.xml"/>
<include-structs href="struct_bunch.xml"/>

		<struct name="CONFIG">
			<field name="OFFSETS" type="long" />
			<field name="SUBVOLUMES_PER_OFFSET" type="long" />
			<field name="BUNCHES_PER_OFFSET" type="long" />
			<field name="handle_Job" type="long" />
			<field name="handle_TT" type="long" />
			<field name="NThreads" type="long" />
		</struct>
</structs>
